{
  "ruleset_id": "damping-v0.1-defaults",
  "version": "0.1.0",
  "promotion_thresholds": {
    "draft_after_events": 1,
    "skill_candidate_after_successes": 3,
    "case_candidate_after_failures": 2,
    "policy_requires_approval": true,
    "high_risk_requires_contract": true
  },
  "cooldown_policy": {
    "verifier_failures": 2,
    "same_mode_failure_window": "24 hours",
    "cooldown_duration": "24 hours",
    "escalation": "pause publication and require owner review"
  },
  "high_risk_actuators": [
    "public_posting",
    "provider_route",
    "session_mechanics",
    "background_timer",
    "persistent_deletion",
    "persistent_memory_write",
    "security_policy"
  ],
  "controller_conflict": {
    "primary_writer_required": true,
    "advisory_only_when_conflict": true
  },
  "notes": [
    "One event may create a draft only.",
    "High-risk actuators stay blocked until a control contract and approval record exist."
  ],
  "created_at": "2026-05-09T08:00:00Z"
}
